id	source	text	satisfaction	satisfaction_std	satisfaction_bucket	satisfaction_support	considerateness	considerateness_std	considerateness_bucket	considerateness_support	dedication	dedication_std	dedication_bucket	dedication_support	emotion	emotion_std	emotion_bucket	emotion_support
750	twitter	hi you can find information regarding damage fees at take care	3	0	3	2	3.5	0.7071067812	4	2	3	0	3	2	1	0	1	2
751	twitter	thank you for the information let us try this link to get your account unblock keep us posted hi luke following up with you to see if your issue got resolved message us back if you need further assistance	3	0	3	2	4.5	0.7071067812	5	2	4.5	0.7071067812	5	2	2	0	2	2
752	ubuntu	It uses a file, the only difference is that Wubi adds an entry to the Windows boot menu to allow you to select Ubuntu from the boot manager	3	0	3	2	3	0	3	2	3	0	3	2	1	0	1	2
753	twitter	your driver just ran a red light and then blocked the intersection for the guy behind him thought you should know uber	2.5	0.7071067812	2	2	3	0	3	2	3	0	3	2	2.5	0.7071067812	3	2
754	air_customer	However, there was a couple at our hotel who flew out on another Ryanair flight and were charged the £40 for being a kilo over weight.	2.5	0.7071067812	2	2	3	0	3	2	3	0	3	2	1	0	1	2
755	airline	I have trip to chicago-singapore-bali-chicago and equal economy fare United ORD-HNG-SIN or Qatar ord-qatar-sin, bali-qatar-ord it's further should I take world's #1 airline or more direct route on United	3	0	3	2	3	0	3	2	3	0	3	2	1	0	1	2
756	yahoo	I have very small stuff stuck under my keyboard and it prevents it to from working.	2	0	2	2	3	0	3	2	3	0	3	2	1.5	0.7071067812	2	2
757	twitter	email address amp phone number we will check and provide you an update	3	0	3	2	3	0	3	2	3.5	0.7071067812	4	2	1	0	1	2
758	asapp	Once it has you can reach back out to customer service to start the return process.	3	0	3	2	3	0	3	2	3.5	0.7071067812	4	2	1	0	1	2
759	yahoo	It's a smaller, four-stringed version of the guitar.	3	0	3	2	3	0	3	2	3	0	3	2	1	0	1	2
760	yahoo	\n10 Adorn yourself with majesty now, and with grandeur, and clothe yourself with glory and honor;\n11 pour forth the outbursts of your anger; yea, look on everyone who is proud, and bring him down low;\n12 look on everyone who is proud, and humble him, and trample the wicked in their place;\n13 hide them in the dust together; bind their faces in darkness.	3	0	3	3	2.666666667	0.5773502692	3	3	3	0	3	3	2.666666667	1.527525232	3	3
761	twitter	im not sure what you mean gimme da ting rt thanks for jeep sweepstake giveaway	3	0	3	2	3	0	3	2	3	0	3	2	1.5	0.7071067812	2	2
762	ubuntu	Right now i'm looking for the package that provides 'dh_testdir'	2.5	0.7071067812	2	2	3	0	3	2	3	0	3	2	1	0	1	2
763	twitter	our colleagues will obtain the information our food team will need to look into this 22	3	0	3	2	3	0	3	2	3	0	3	2	1.5	0.7071067812	2	2
764	trip_advisor	I call back 5 minutes after I’ve hung up with the agent the first time, and she tells me that flight prices have gone up.	2	0	2	2	3	0	3	2	3	0	3	2	2.5	0.7071067812	3	2
765	twitter	please dont provide your details here as we consider them to be personal information our page is visible to public kindly reach our support team here we will have it checked	3	0	3	2	4	0	4	2	3.5	0.7071067812	4	2	1.5	0.7071067812	2	2
766	ubuntu	I just put in some dns-server I know works instead.	3	0	3	2	3	0	3	2	3	0	3	2	1	0	1	2
767	github	This can be done by a parameter called docker tag which is defaulted to the one from the job definition.	3	0	3	2	3	0	3	2	3	0	3	2	1	0	1	2
768	github	We've recently introduced some linux users (we had some a year ago) but the script no longer populates the envars.	2.5	0.7071067812	2	2	3	0	3	2	3	0	3	2	1	0	1	2
769	air_customer	They took the view that it is a "poison" and confiscated it accordingly.	2.5	0.7071067812	2	2	3	0	3	2	3	0	3	2	2	0	2	2
770	ubuntu	it would just be useful to have at least build essentials (which is on the cd!)	2	0	2	3	3	0	3	3	3	0	3	3	2.666666667	1.527525232	3	3
771	ubuntu	I was just wondering if it's possible to automate an already created "blacklist" and have it utilized for squid.	3	0	3	2	3	0	3	2	3	0	3	2	1	0	1	2
772	yahoo	Which car and house insurance company is recommended in California?	3	0	3	2	3	0	3	2	3	0	3	2	1	0	1	2
773	asapp	Ok I pulled up the order in the system and unfortunately it looks like the fee was due to user error.	2.5	0.7071067812	2	2	3	0	3	2	3	0	3	2	1.5	0.7071067812	2	2
774	trip_advisor	Hi Ok apart from all the jokes about having a goatee for 'Movember', just wondered what passport control in the UK and US will say as my current passport is clean shaven.	3	0	3	2	3	0	3	2	3	0	3	2	1.5	0.7071067812	2	2
775	airline	My question is do I go back to blue membership at the end of the year when it expires or do I stay on Bronze and continue to work towards silver.	3	0	3	2	3	0	3	2	3	0	3	2	1	0	1	2
776	trip_advisor	My concern is if I book with Expedia and anything goes wrong who do I deal with?	2.5	0.7071067812	2	2	3	0	3	2	3	0	3	2	2	0	2	2
777	trip_advisor	I can fly to that city on my points, then go to Medellin.	3	0	3	2	3	0	3	2	3	0	3	2	1	0	1	2
778	yahoo	Can I view everything on the Internet via the wireless network?	3	0	3	2	3	0	3	2	3	0	3	2	1	0	1	2
779	airline	I already have my seat selections on United through the reservation process, but not on Swiss.	3	0	3	2	3	0	3	2	3	0	3	2	1	0	1	2
780	yahoo	I hope these help you decide whether to head to the health store or not.	3	0	3	2	3.5	0.7071067812	4	2	3	0	3	2	1	0	1	2
781	yahoo	As a result of the "fight or flight" response, the capillaries that carry blood to the skin widen, and the increased blood flow lends the face, as well as sometimes the chest, neck, or even the body or legs, a reddened color.	3	0	3	2	3	0	3	2	3	0	3	2	1	0	1	2
782	airline	i was surprised to find the best fare from British Airways for everything, (i had been doing a patchwork of different airlines) but then remembered there were strike issues.	2.5	0.7071067812	2	2	3	0	3	2	3.5	0.7071067812	4	2	2.5	0.7071067812	3	2
784	yahoo	It would certainly seem that humans are growing taller on average, and what western (cultural bias) woman does not want a tall mate for example.	3	0	3	2	3	0	3	2	3	0	3	2	1	0	1	2
785	yahoo	Because of this, she has a hard time maintaining friendships and family relationships.	2.5	0.7071067812	2	2	3	0	3	2	3	0	3	2	2	0	2	2
786	ubuntu	I'm looking for a linux backup program that can create complete disk images (i.e. restore and its bootable and all working) that can also do incremental changes to these images stored on a share accessible via CIFS/RSYNC.	3	0	3	2	3	0	3	2	3	0	3	2	1	0	1	2
787	yahoo	So as the rotors turn, air flows more quickly over the tops of the blades than it does below.	3	0	3	2	3	0	3	2	3	0	3	2	1	0	1	2
788	trip_advisor	I've heard that delays of up to 3 hours could be experienced for incoming passengers.	2	0	2	4	3	0	3	4	3	0	3	4	1.25	0.5	1	4
789	twitter	hey there please fill out this ticket form and we will get back to you asap thanks d	3	0	3	2	4	0	4	2	3.5	0.7071067812	4	2	1.5	0.7071067812	2	2
790	ubuntu	My guess is it was dumbed down to allow people that do not comprehend regex to use grep to search things without knowing case matters by default normally...	3	0	3	2	2.5	0.7071067812	2	2	3	0	3	2	2.5	0.7071067812	3	2
791	trip_advisor	Am flying to NAN next month with V Australia though flight is booked through Virgin Blue so I can utilise a voucher I have with them.	3	0	3	2	3	0	3	2	3	0	3	2	1	0	1	2
792	yahoo	Many of these new buildings were taller than anything ever built before and most had elevators.	3	0	3	2	3	0	3	2	3	0	3	2	1	0	1	2
793	air_customer	I know there are no guarantees that the fares will come down, but I would really appreciate any advice on this.	3	0	3	2	4	0	4	2	3	0	3	2	2	0	2	2
794	trip_advisor	I chose USAir because the itinerary and times were great and the First Class fare was a steal!	4.666666667	0.5773502692	5	3	3.333333333	0.5773502692	3	3	4.333333333	0.5773502692	4	3	3.333333333	1.154700538	3	3
795	air_customer	The crying and screaming of so many babies setting each other off led to those paying passengers around them getting less service from the staff, while they concentrated their attention on the young children.	1.5	0.5773502692	1	4	2.5	0.5773502692	2	4	2.75	0.5	3	4	2.75	0.5	3	4
796	airline	I certainly paid enought for the ticket and don't see any reason to give more money for something that never cost money until now.	2	0	2	2	2.5	0.7071067812	2	2	3	0	3	2	3.5	0.7071067812	4	2
798	trip_advisor	The Airline and our travel insurance sorted it all out, no problem.	4	0	4	2	3	0	3	2	3	0	3	2	2	0	2	2
799	yahoo	It's easier to live by one's own convictions and not be persuaded by others when in isolation (that's the "independence of solitude").	3	0	3	2	3	0	3	2	3	0	3	2	1.5	0.7071067812	2	2
800	yahoo	It is also popular on New Year's day and some serve it on Thanksgiving.	3	0	3	2	3	0	3	2	3	0	3	2	1	0	1	2
801	yahoo	Next she turned professional and began touring the country, exhibiting her prowess in track, swimming, tennis, baseball, and even billiards.	3	0	3	2	3	0	3	2	3	0	3	2	1	0	1	2
802	airline	When i book a flight from amsterdam to usa we have to make a transfer.	3	0	3	2	3	0	3	2	3	0	3	2	1	0	1	2
803	ubuntu	which packages are required for a development environment of C/C++?	3	0	3	2	3	0	3	2	3	0	3	2	1	0	1	2
804	yahoo	Are you getting the Dynamic IP assigned by the router?	3	0	3	2	3	0	3	2	3	0	3	2	1	0	1	2
805	yahoo	The Hawai'ian spelling 'ukulele is also sometimes seen.	3	0	3	2	3	0	3	2	3	0	3	2	1	0	1	2
806	twitter	we offer support via twitter in english get help in spanish here or join	3	0	3	2	3.5	0.7071067812	4	2	3	0	3	2	1	0	1	2
807	ubuntu	I don't know what the current name of the print server on Ubuntu is, but you can probably use it to share your printer to Windows (I think) or you can use samba to do the same	3	0	3	2	3	0	3	2	3	0	3	2	1.5	0.7071067812	2	2
808	ubuntu	i got that part, i mean after you pass the login window, when the ubuntu music plays, i want to change the orange rectangle in the middle	2.5	0.7071067812	2	2	3	0	3	2	3	0	3	2	2	0	2	2
809	twitter	i sincerely apologize for our delayed response to you ann do you need any additional assistance form me at this time	3	0	3	3	4.333333333	1.154700538	4	3	3.666666667	0.5773502692	4	3	2.333333333	1.527525232	2	3
810	twitter	no point know now service is cancalled now having to spend for alternative travel does not help my wallet seriously dang right disgusted that this happens every day seriously need to stop up your game here	1	0	1	2	1.5	0.7071067812	1	2	2.5	0.7071067812	2	2	4.5	0.7071067812	5	2
811	trip_advisor	QF has 2 free bags, but AS charges something like $20 per bag for domestic flights and "Through January 2013 customers making international connections to other airlines within twelve hours of arriving in the connection city, may follow the baggage allowance and weight restrictions of the international airline if there is a baggage agreement in place" Anyone know if that clause still applies?	2.5	0.7071067812	2	2	3	0	3	2	3	0	3	2	1.5	0.7071067812	2	2
812	asapp	I do not have any way to change the shipping cost.	2.5	0.7071067812	2	2	3	0	3	2	3	0	3	2	1.5	0.7071067812	2	2
813	airline	I need to make a decision on this before tomorrow.	3	0	3	2	3	0	3	2	3	0	3	2	1.5	0.7071067812	2	2
814	air_customer	Instead of being helpful and sympathetic the Australian staff working behind the counters sent me away 4 times to different counters to try and sort out my problem which took over an 1 1/2 hours.	1	0	1	2	2.5	0.7071067812	2	2	2.5	0.7071067812	2	2	4	0	4	2
815	ubuntu	Has anyone here toyed with the idea of starting X with a *very* minimalistic WM, and then starting a VNC session in it with your WM of choice?	3	0	3	2	3	0	3	2	3	0	3	2	1	0	1	2
816	trip_advisor	The airline's grounds services at JFK is not efficient for a large group.	2.166666667	0.4082482905	2	6	2.833333333	0.4082482905	3	6	2.666666667	0.8164965809	3	6	1.166666667	0.4082482905	1	6
817	ubuntu	if you're already running edgy, I suggest the alternate CD, then you can upgrade instead of re-install	3	0	3	2	3	0	3	2	3	0	3	2	1.5	0.7071067812	2	2
818	asapp	As a guest you are going to need to wait until the order has physically delivered to you.	3	0	3	2	3	0	3	2	2.5	0.7071067812	2	2	1.5	0.7071067812	2	2
819	trip_advisor	we won't see it again until Sydney  or are we in some kind of 'in transit' limbo and have to stay within a certain area-I was thinking of booking the terminal 3 servisair lounge and wanted to make sure we could actually go there.	2.5	0.7071067812	2	2	3	0	3	2	3	0	3	2	2	0	2	2
820	asapp	Would you like to use the credit card we already have on file?	3	0	3	2	3	0	3	2	3	0	3	2	1	0	1	2
821	air_customer	I certainly paid enough for the ticket and don't see any reason to give more money for something that never cost money until now.	1.5	0.7071067812	1	2	2	0	2	2	2.5	0.7071067812	2	2	3.5	0.7071067812	4	2
822	yahoo	In the US, the threshold for gold is half a million, the threshold for platinum is one million.	3	0	3	2	3	0	3	2	3	0	3	2	1	0	1	2
823	twitter	oh no sorry to hear that please send us a note at and a member of our team will follow up	2.666666667	0.5773502692	3	3	3.666666667	0.5773502692	4	3	4	1	4	3	2.333333333	1.527525232	2	3
824	github	There should be an escape sequence to close the connection from the client side.	2.5	0.7071067812	2	2	3	0	3	2	3	0	3	2	1	0	1	2
825	trip_advisor	It also seems that all the left luggage counters are "airside".	3	0	3	2	3	0	3	2	3	0	3	2	1	0	1	2
826	trip_advisor	Hi all - I'm kind of new to air travel and I would appreciate anyone's advice.	3	0	3	2	3.5	0.7071067812	4	2	3	0	3	2	1	0	1	2
827	trip_advisor	We can do on-line check-in 24 hrs prior to flight, but this of course wont garentee anything.	3	0	3	2	3	0	3	2	3	0	3	2	1	0	1	2
828	yahoo	\nNote: If you find that booting from CD doesn't work, you may have to adjust your BIOS setting to allow your machine to boot from CD.	3	0	3	2	3	0	3	2	3	0	3	2	1	0	1	2
829	twitter	hi there as your flight is operated by aer lingus you will have to call them to choose seats and your meals	3	0	3	2	3	0	3	2	3	0	3	2	1.5	0.7071067812	2	2
830	ubuntu	anyone know any decent gui torrent apps lighter then azureus?	3	0	3	2	3	0	3	2	3	0	3	2	1	0	1	2
831	twitter	i already have the x i meant my total bill we are all about giving you the hookup take a look at our iphone x deal jasmines	2.5	0.7071067812	2	2	3	0	3	2	3.5	0.7071067812	4	2	1	0	1	2
832	twitter	oh well that is easy let us take a look at your billing send us a message dm for assistance jasmines	3.5	0.7071067812	4	2	3.5	0.7071067812	4	2	3.5	0.7071067812	4	2	2	0	2	2
833	airline	At 4 days prior to departure if the application is good I can request a emergancey appointment with the Miami agency.	3	0	3	2	3	0	3	2	3	0	3	2	1.5	0.7071067812	2	2
834	yahoo	When it doesn't break down it beats the Renault handily.	3	0	3	2	3	0	3	2	3.5	0.7071067812	4	2	1	0	1	2
835	twitter	we are sorry to hear this we can assure you our crew is working on a fix	2.5	0.7071067812	2	2	4	0	4	2	4	0	4	2	2	0	2	2
836	yahoo	What site can I go to to find out how many seconds are in a year?	3	0	3	2	3	0	3	2	3	0	3	2	1	0	1	2
837	twitter	we will not be able to provide a definite date we are working on your issue you may reply to the email with further queries	2.5	0.7071067812	2	2	2.5	0.7071067812	2	2	2.5	0.7071067812	2	2	1.5	0.7071067812	2	2
838	yahoo	Better to spend our time enjoying our wonderful world and helping our fellow beings instead of arguing about which brand of imaginary supernatural friend is the "right one".	2.5	0.7071067812	2	2	2.5	0.7071067812	2	2	3	0	3	2	2.5	0.7071067812	3	2
839	air_customer	I'd like to hear of experiences and thoughts on them!	3.2	0.4472135955	3	5	3.8	0.8366600265	4	5	3.6	0.894427191	4	5	3.2	0.8366600265	3	5
840	ubuntu	Bluel, I actually read up on Small Basic, its a very honest and interesting project, meant specifically for people new to programming.	3.333333333	0.5773502692	3	3	3	0	3	3	3	0	3	3	1.666666667	1.154700538	2	3
841	trip_advisor	Perhaps Emirates Skyrewards is less restrictive on claiming miles?	3	0	3	2	3	0	3	2	3	0	3	2	2	0	2	2
842	asapp	You will need to use a coarse brush or toothbrush to get rid of the dried extra paint.	3	0	3	2	3	0	3	2	3	0	3	2	1	0	1	2
843	airline	Other than that, it was just fine - plane left and arrived on time.	3.5	0.5773502692	4	4	3	0	3	4	3	0	3	4	1.75	0.5	2	4
844	ubuntu	some debian users worry that ubuntu isn't a good choice as it may branch further and further from debian over the years, eventually evolving into a mutual exclusivity on the level of some basic debian administration tools and methods.	2	0	2	2	3	0	3	2	3	0	3	2	2	0	2	2
845	asapp	Okay and a package of your size would probably be in the 5-10 pound range	3	0	3	2	3	0	3	2	3	0	3	2	1	0	1	2
846	asapp	Also I will write up a report to let our purchasing department know so they can do a better job	2	0	2	2	3	0	3	2	4	0	4	2	2	0	2	2
847	trip_advisor	I have read the website and I want some clarification if anyone can help please I am taking a checked in bag (which does not have my skis in ) as part of 23kg allowance I am probably being slow on the uptake but did not think it was clear on website??	2	0	2	2	3	0	3	2	3	0	3	2	2.5	0.7071067812	3	2
848	yahoo	likely meant that every zig fighter needed to take off to battle the mysteriously robotic villian of the game, known only as &quot;Cats.&quot;	3	0	3	2	3	0	3	2	3	0	3	2	1.5	0.7071067812	2	2
849	airline	I asked 4 times before he finally agreed to let me speak to a supervisor.	2	0	2	2	2	0	2	2	3	0	3	2	3	0	3	2
850	air_customer	Knowing I might have a problem with dates, I also took out their insurance policy for possible changes to my scheduled flights.	3	0	3	2	3	0	3	2	3	0	3	2	1.5	0.7071067812	2	2
851	trip_advisor	We have an 8 year old and a 5 year old and are trying to workout whether its best to give them a quick meal before we board so they can go straight to sleep or whether all the activity means they are going to be awake for quite awhile after take off!	3	0	3	2	3	0	3	2	3	0	3	2	2.5	0.7071067812	3	2
852	twitter	can you please message dm me i am following you its regarding an order	3	0	3	2	4	0	4	2	3	0	3	2	1.5	0.7071067812	2	2
853	yahoo	when I was in college denny's always worked for me.	4	0	4	2	3	0	3	2	3	0	3	2	1.5	0.7071067812	2	2
854	trip_advisor	I also went on a few travel review sites seems that I am one of many people who have had a bad experience with this airline.	1.5	0.7071067812	1	2	3	0	3	2	2.5	0.7071067812	2	2	2	0	2	2
855	airline	To top it off they lost our bags too - from reading other reviews it sounds like we got the 'full' BA experience.	1.333333333	0.5773502692	1	3	2.333333333	0.5773502692	2	3	2.333333333	1.154700538	2	3	3	1	3	3
856	airline	Anyway, I'm having trouble figuring out when to book it.	2	0	2	2	3	0	3	2	3	0	3	2	2	0	2	2
857	yahoo	Both Supermen were supplanted by John Byrne's 1985 reboot of the character, which was intended to simplify that continuity and start over from scratch.	3	0	3	2	3	0	3	2	3	0	3	2	1	0	1	2
858	ubuntu	My firefox browser disappears into the middle of the screen when I minimize it never to be seen again... can someone help me?	1.666666667	0.5773502692	2	3	3.333333333	0.5773502692	3	3	3	0	3	3	2.666666667	1.154700538	3	3
859	air_customer	There always seems to be scatch cards coming around on the package tour planes where we are told a percentage goes to a charity but does anybody know what percentage is actually given to the charity?	2.5	0.7071067812	2	2	3	0	3	2	3	0	3	2	1.5	0.7071067812	2	2
860	trip_advisor	I don't mind walking the extra 100 yds and I loathe driving round looking for a space.	1.666666667	0.5773502692	2	3	3	0	3	3	2.666666667	0.5773502692	3	3	3	1	3	3
861	github	I tried different hosts and different apps that use Apple virtualization_ namely [Tart](https://github.com/cirruslabs/tart/) and [VirtualBuddy](https://github.com/insidegui/VirtualBuddy).	3	0	3	2	3	0	3	2	3	0	3	2	1	0	1	2
863	twitter	sorry for the stretch please check our correspondence here here and reply for further concern	2.5	0.7071067812	2	2	3.5	0.7071067812	4	2	3	0	3	2	2	0	2	2
864	asapp	Since you had this item in your cart yesterday for a lower price I would like to honor that by genera	3.25	0.5	3	4	4	0	4	4	3.75	0.5	4	4	1.75	0.5	2	4
865	airline	I'll be travelling from Sydney to Yogyakarta on Garuda next month and must change from the international flight to the domestic flight at Denpasar.	3	0	3	2	3	0	3	2	3	0	3	2	1	0	1	2
866	twitter	hi the voucher has been recharged confirm your airtime balance by dialing 144 ok	3	0	3	2	3	0	3	2	3	0	3	2	1	0	1	2
867	trip_advisor	Convenience, distance/time to departure hall, under cover?	3	0	3	2	3	0	3	2	3	0	3	2	1	0	1	2
868	asapp	I need your Adress so you can print a shipping label	3	0	3	2	3	0	3	2	3	0	3	2	1	0	1	2
869	yahoo	Lead singer and bassist, Gerard and Mikey Way's grandmother.	3	0	3	2	3	0	3	2	3	0	3	2	1	0	1	2
870	twitter	please reach out to us here for further assistance with this	3	0	3	2	4	0	4	2	3.5	0.7071067812	4	2	1.5	0.7071067812	2	2
871	asapp	If that doesn't work I can try to place the order for you.	3	0	3	2	3	0	3	2	4	0	4	2	1.5	0.7071067812	2	2
872	yahoo	\n\n\nThey also discovered that people had an exaggerated sense of time because they had nothing to do but stare at the wall and think about the safety of the elevator  being suspended in the air, and preoccupied with the fear of falling.	3	0	3	2	3	0	3	2	3	0	3	2	1.5	0.7071067812	2	2
874	trip_advisor	I've read and heard conflicting reports on amenities in economy.served on the flight?	2	0	2	2	3	0	3	2	3	0	3	2	2	0	2	2
875	asapp	Your refund is in progress and will be completed online and  applied directly to your credit card used when you placed the order.	3	0	3	2	3.5	0.7071067812	4	2	3	0	3	2	1	0	1	2
876	twitter	yo i just had a uber ride for 257 but it actually did two charges and took extra 15 never did something like this in slovakia	1.666666667	0.5773502692	2	3	2.333333333	0.5773502692	2	3	2.666666667	1.527525232	3	3	3	0	3	3
877	asapp	It looks like everything is in order and our system is showing that the package is on its way.	3	0	3	2	3	0	3	2	3	0	3	2	1	0	1	2
878	trip_advisor	The question is why are all suitcases on the market these days flimsy soft and zipped ?	2	0	2	2	3	0	3	2	2.5	0.7071067812	2	2	2.5	0.7071067812	3	2
880	airline	The fare rules of the ticket state that it's non-refundable but as it's the airline who have cancelled the flight and the alternative flight is not an option, do she have any right to a refund?	2.25	0.5	2	4	3.25	0.5	3	4	3.25	0.5	3	4	1.5	0.5773502692	2	4
881	trip_advisor	Besides，the same situation happened to my friend WU WEI too (Please see the attached copy of her passport in my email ) .	2.5	0.7071067812	2	2	4	0	4	2	3	0	3	2	1.5	0.7071067812	2	2
882	asapp	Yes i have just checked and your account does offer free international shipping	3	0	3	2	3.5	0.7071067812	4	2	3	0	3	2	1	0	1	2
883	ubuntu	it looks like guvcview is battling some other program for control of your webcam.	2.5	0.7071067812	2	2	3	0	3	2	3	0	3	2	1.5	0.7071067812	2	2
884	trip_advisor	I tried to call the airline but nobody picked up, now I'm waiting for the reply email which I don't know whether they will even cared to read.	1.75	0.5	2	4	2.5	0.5773502692	2	4	2	0.8164965809	2	4	3.5	0.5773502692	4	4
885	trip_advisor	So I'm looking to book a flight this summer for Calgary to Singapore then back to Calgary through Bali.Or is it just a matter of the people that complain are the loudest type thing?	2.666666667	0.5773502692	3	3	3	0	3	3	3	0	3	3	2.333333333	1.154700538	2	3
886	trip_advisor	I want to make sure you know I'm not one of those people.	3	0	3	2	3.5	0.7071067812	4	2	3	0	3	2	1.5	0.7071067812	2	2
887	trip_advisor	They asked whether this would happen on the return so I telephoned (yes this is an airline where you can speak to real people.)	3	0	3	3	2.666666667	0.5773502692	3	3	3.666666667	0.5773502692	4	3	2.666666667	1.154700538	3	3
888	ubuntu	yeah but i don't have any ALSA entry in there besides the one that mentions PulseAudio (and the one I was using: HDA Intel (Alsa mixer) )	2	0	2	2	3	0	3	2	3	0	3	2	1	0	1	2
889	trip_advisor	Oh, but then they might lose business, better to have a captive angry passenger than no passenger at all.	2	0.5773502692	2	7	2.428571429	1.133893419	2	7	2.142857143	1.214985793	2	7	3.142857143	1.069044968	3	7
890	air_customer	Hi, I'm flying Gold Coast, AUS to Narita airport, Japan at the end of the month.	3	0	3	2	3.5	0.7071067812	4	2	3	0	3	2	1	0	1	2
891	asapp	Since it is already out for delivery the best I can do is offer you part of the shipping fee as a refund.	3	0	3	2	3.5	0.7071067812	4	2	3.5	0.7071067812	4	2	1	0	1	2
892	asapp	so your supposed to have credits on your account but they appear to be missing?	3	0	3	2	3	0	3	2	3	0	3	2	1	0	1	2
893	asapp	Okay it does look like there was an issue with this order.	2.5	0.7071067812	2	2	3	0	3	2	3	0	3	2	1.5	0.7071067812	2	2
894	airline	Im travelling from Sydney to Toronto via Vancouver and would like to bring back a bottle of wine or two from Duty Free.	3	0	3	4	3	0	3	4	3	0	3	4	1.5	0.5773502692	2	4
895	twitter	do you currently have any updates for apps downloading if you restart the iphone do you still get that message on wi	3	0	3	2	3	0	3	2	3	0	3	2	1	0	1	2
896	trip_advisor	Good morning/evening, We had a question prompted on my local forum which I couldn't answer very well, and seeking to now further my knowledge.	2	0	2	2	4	0	4	2	3	0	3	2	1.5	0.7071067812	2	2
897	yahoo	As a current PT student, I have an *amazing* network of rising stars at a number of bay area companies, right now.	4.5	0.7071067812	5	2	3	0	3	2	3.5	0.7071067812	4	2	4	0	4	2
898	ubuntu	i used the repos http://www.ubuntugeek.com/how-to-install-chromium-google-chrome-in-ubuntu-using-deb-package.html	3	0	3	2	3	0	3	2	3	0	3	2	1	0	1	2
899	yahoo	"So policemen are just those who catch or apprehend criminals, a worthy occupation.	3.5	0.7071067812	4	2	3	0	3	2	3.5	0.7071067812	4	2	2.5	0.7071067812	3	2
900	ubuntu	does anyone know of any data recovery software that recovers the filenames as well as the files?	3	0	3	2	3	0	3	2	3	0	3	2	1	0	1	2
