emotion_bucket,text
4,scream me softheaded but we sleep together the suggestion we will be certain to go along
4,Yesterday I was in the economy class of Turkish Airlines on my way back home but still had one of the best meals I ' ve e'er have on panel (aand it was free! )
4,monolithic thank you to and for getting this purpose for me in a timely personal manner they handled my crankiness advantageously
4,it earn me sick dawg chipotle raging trash the disrespect is literal brodie
4,Bawl out me for an inapplicable root when you haven ' t specified your full prerequisite isn ' t helpful.
4,"However, the tangible disaster was in reality the coming rearwards trip up!!"
4,i hate your website tried multiple times in a booking and it will not continue to payment and hangs try on all dissimilar browsers no choice but to book thru travel broker but exec line treats travel agency hold like pariah why
4,They offered atomic number 102 commission or help other than ask multitude to leave the carge office.
4,motive to fix whatsoever tf is going on w my earphone i cant even listen to my euphony i pay for it i better be able to listen to it
4,since amazon cancelled my uk membership i am stupefy with chetan bhagat in the lit section do you even have it off what literature is fuck
4,"Are my expectation undue (do not hook for services, replay to complaint email )? ???"
4,"And I, on the other hand, am extremely disordered and baffle that I can ' t speak to Aeromexico directly (or e mail them, for that matter )."
4,that is not true at all the regular price for two yrs is rs 89376 and the discounted price is rs 89376 if the promotional code was genuinely valid there would have been a 25 drop as claimed in the last discounted price so far lean a fake sale i recvd an email offering 25 off on my next new purchase so i went over to bcoz i wanted a new domain and it seems that you are not offering a 25 discount at all cheap pr stunt i must say you will lose customers i tell you that one
4,The complete unfitness of anyone representing AA at the airport or on the phone to deal the office was beyond irresponsible.
4,Their surety stave is rude and there is no construct of organized embarkation at Heathrow.
4,i am having so much worry with my apple gem state accepting my defrayal details i cannot download or update anything i am about to go to android this is horrible nothing is working for me
4,why should we be loyal to your airline so far again for an international escape youve placed me in a middle seat diamondmeansnothing
4,What ' s the next move (besides plain never flying with them once again and notify everyone I know to do the like )?
4,One concierge even bosom me when we left and state she was decease to escape me!
4,I just had the bad experience book flights to United mexican states with Interjet.
4,after 4 recaptcha i finally got to paywhat a regretful user experience i got herenearly make not want to buy any longer
4,We lost a unscathed clarence day in Italian capital b / c Delta has no clue how to decent service their planes.
4,"Only to be told that they put on ' t give insurance or cancellation advice on this issue, you want to do it online! !!"
4,you have failed to install my internet for two days several headphone call in and i cant even get a manager incompetent person wastedmyweekend
4,this new email variety sucks detest it go backward to onetime notfunctional
4,These were families with child waiting and this was an preposterous style to treat the office.
4,absolute jape after hold off all day for an order of magnitude placed on fri on prime
4,I have been fundamentally been surcharge and this could have turned out alot worse than it do had i missed my connecting flight.
4,massively discomfited with deuce of your restaurants tonight
4,i detest you how tough is it to not position onion in my greaser
4,"If they can not responsibly ship a dog iron, YOU are not dependable on this Airline."
4,will there be an update coming soon thats gonna fix my electric battery offspring or should i just throw away the whole phone and use a pigeon
4,"When I bribe a plot, I make an agreement between me and the producer - not a contact! badness MOVE Activision."
4,"The employees are incompetenent, don ' t guardianship and the airline is incapable of being trusted to enrapture an animal, nestling or anything of value."
4,"After speaking with an highly unhelpful and rude supervisor, and explaining our situation, she said she would look into further and disappeared, only to return xlv min later to once again repeat there were no seats for us."
4,What is to the highest degree frustrating is that there is no way to find a escape with two upgrade - able seats without calling alcoholics anonymous - - and waiting through three minutes of canned drivel before we find a illustration and go through the whole ' wanna ' list with her.
4,I am flying Virgin Australia to Los Angeles and absolutely hate plane food (always have horrible venter pains after eating it) Wanting to bring my own food on the aeroplane but concerned with customs etc with what I can bring instead of paying large amounts of money for food beyond customs which is as horrible.
4,The passage at Heathrow (a refueling and more passengers stop) was the well nigh miserable experience in all our wing years. .. . We would not recommend to anyone flying through and through Heathrow as transit passengers.
4,I am writing today to state you how disappointed I am in your misleading business practice and disgusted I am with your client support (a common thread in many reviews for your fellowship ).
4,I should have bed better than to book a low - cost flight of steps through an way. .. or at least through That agency!
4,"I tried to call the airline but cypher picked up, now I ' m waiting for the response email which I wear ' t know whether they will even manage to understand."
4,We were proud of with our flights and now see forward to our slip on the Dreamliner this summertime.
4,"And, its been reappropriated by the pretty people as a marvelous facial crinkle pick."
4,"As a current PT scholar, I have an * amazing * network of rising stars at a bit of bay surface area companies, decent now."
4,I was only wondering: And something totally dissimilar: Thanks you blackguard!
4,All the same our scheme tell I can form you a new Promo computer code now!
4,They promptly checked us in and to our surprisal we were all seat in concert 9ABCDE.
4,my momma always asks me if i want mcdonalds and i believe that is rlly beautiful
4,"Voila - - no checkered baggage, no carry - on luggage, no problems (and hold out insolent - flops on your feet )."
4,this is how ups delivered my software package out 800 of yule money for my 5 child angry mommy
4,help me rt okay the box seat annoy i updated my phone what else do you require from me
4,Every flight on associate in arts that we ' ve taken since the merger we could hear the flight attendants complain and they could care less about the service.
4,Instead of be helpful and sympathetic the Australian staff work behind the counters sent me out 4 times to dissimilar counters to try and sort out my problem which read over an 1 1 / 2 hours.
4,I certainly pay enough for the ticket and father ' t see any reason to ease up more money for something that never cost money until now.
4,What is the degree of client maintenance broker when they have to confabulate every question.
4,"In a way, this may be Bush ' s genius, that he understand what lies American language are uncoerced to bear, and not go for."
4,i had already sent the details in message decimetre amp speak to customer services but no body tells why do you necessitate extra information from me yet every detail is same you reverify every account annually what is your criteria to do so
4,They forced us to check our bags or pay various century dollars to extend them on even though we had less then when we went down and the bags were received carry size for any other airline.
4,We were originally looking at book thru escape meat but they require to charge us $ 20 extra per person per flight on top of flight price to get a ticket I just finger ripped off so I ' m looking at booking direct myself.
4,i recognise my internet upper technically says up to 25mb but all i am getting is 8mb that is not yet half not acceptable
4,9 daytime and counting tho appreciate people are busy and have workloads to get through but 9 day without a reply that is quite a lot is not it
4,"I aviate this route annually / bi - per year to chat in - laws with my children and husband who were on this flight with me, they ' re all fine (kids were 16 months and deuce ace ), I ' m still a muddle, can ' t watch safety video and have to take valium."
4,"I call Delta, who say there was naught they could do - if the travel agent gain ' t modification it, I ' m SOL."
4,\ n \ grandmother alternative account is the well fixed one: there is no G - d.
4,Also they did send me an email with an offer of a voucher to be redeemed on a future Thomas cook holiday (buy the farm in twelve month) but as I am ineffective to do that I have asked them to send me a cheque which you are legally entitled to do.
4,I am wholly bewildered with the regularisation at this point!
4,She was model following to me and said that she would have been dismiss on the stain for such a landing!
4,can you please stop making me update my xbox every mates of clarence shepard day jr. i dont get many day off and i want to be able bodied to play
4,how the heck is that potential it is a add in write out by yall
4,"The lesson of the story use yoru mastercard as I did and dispute the transaction on return and so they wil actually listen as the Reservation was made from the UK our rules apply regardless of the lack of clarity on the Airasia site so I will update the outcome, for me its not about the £ 20 its more about the priciple now so fight on; )"
4,"The flight leaves late due to late inbound craft - (which is a group b alibi really - - a more honest one would be the craft was late because its on an end to terminate schedule with very tight turnaround times, and we stuffed up somewhere earlier in the clarence shepard day jr. )."
4,can you please tell me wherefore my 7 almost burned a yap in my pants and wherefore my flashlight or camera doesnt employment now
4,it is every appearance even the damn commercials i get ane minutes so bam computer error
4,And this was how I was refund What a stinky client allegiance wages.
4,hey the whole mind of dvr is so you dont have to watch commercialswhat am i yield for
4,really because i used to have 3gb which i never ran out of then all of a sudden id use up all my datum in a month without actually make out anything have to upgrade to 15gb and now i apparently use 80 of that cant wait to switch to 3 roll on end of contract
4,i ordered several hundred dollars deserving of clothes and shoes for a trip i have in a couple days you delivered it to the entirely untimely state sc this needs to be fixed as soon as potential asap and delivered to my name and address in florida nothappy
4,It kind of defeats the use of buy the farm to the airport the day before if we are going to have to stand and queue up in the like queue that we would have stood in had we but taken our cases in the morning!
4,so i used for the first and net time food was more than 1 60 minutes afterwards than prognosticate and was cold nothappy
4,ur refurbished macbook pro sucks shelling percentage quell the like random oscillate sounds and i only get it for 2 months
4,shoutout to the best logic gate agent e'er at very communicatory and instructive
4,"I ' ve been very happy with the stout construction of the Timbuk2 knapsack and messenger bags which I already have, and this case, which holds the Flame perfectly, is no exception."
4,we are so felicitous to hear this tweet us if you of all time have any question or want assistance we are here to support you
4,oh i love nemo got to articulate the drawing is practiced aisha
4,Awesome substantially I ' m well chosen I was able bodied to help you out!
4,"They are genuinely cute; I am a size 9 and they are a wee bit prominent, but I did not return them because they are so comfortable and cool in the summertime."
4,"I regularize this point for my daughter, she perfectly loves it!"
4,"If you do something stupid like dry wash it, and then that ' s a moment, too."
4,"I am seek to choose my seats on "" manage my booking "". .. using seat guru as a templet, but the cabin layout is completely different compared to what rear guru layout says. .. . help!"
4,I like my hurl atomic number 26 and Le Creuset ovens a WHOLE circle better for every imaginable aim.
4,I would like to talk to your director because this is not satisfactory.
4,"Fore warned is fore armed - on a recent vacation to Jamaica my girlfriend became seriously ill and had to be put into a hospital (very frightening as you can imagine) However, when she was released to pilot the next day I called Gentle wind Jamaica and was tell the change fee would be $ 150 each."
4,your new update score it impossible for me to still open my telephone set aspect at the time or do anything
4,"Another Crosman opus of dust hire it out of the box, and it is rattle."
4,There were eleven family line wait and as this drag on with perfectly no communication there was obviously frustration.
4,Your lack of action speaks volume about your business exercise (shady) and you miss of interest group in customer satisfaction.
4,"We be intimate Gamewright biz, and this is speedily go another family favorite."
4,gerry i have been through some things but i have never been through anything like this this is a horrifying story amp im so sorry you experience this i trust takes actions against the driver
4,"Ohio hellow Linux_mafia: thank you for your help, i aslo tried that and it still doesn ' t work."
4,great question send us a diabetes mellitus for the deets colleenlicudine
4,we do kick upstairs the service but realise it could always be better apology for the way out today kevin
4,All in all my flight from the present moment of stoppage in to when I land was an out and out incubus.
4,"i didnt install alpha i didnt gap anything and the proftpd channel is dead, plus google habit help me"
4,"Both times my reservation has been useable online for 4 days, pending windup of dealing with my credit card, so it disappears and I have to start concluded!"
4,"It has been totally substitute by the Scientific Method acting, which is the smashing breakthrough of all time."
4,I paid for a return transfer and didn ' t desire to spend time find an Internet cafe or someplace with wifi to sort something out that I thought I ' d be prebooked as I only have a myopic weekend trip aside. .. please help!
4,Its a expensive holiday hence wherefore call for to bang terms so can save! !!
4,I certainly paid enought for the slate and don ' t see any reason to give more money for something that ne'er be money until now.
4,valet i hold in my datum on the first HD and there is no issuance with that!
4,"My motion is, - most sparing wayOR is there any other option? ???"
4,"My family has booked a holiday with the same change of location agentive role but as 2 different engagement, one for us and the tiddler, another for the in - practice of law!!"
4,"I was scourge, some so rarefied detail, I make bold not guess about it."
4,"I want to be able to see more colors, more than infra - carmine and ultra - violet; I ' m not talking about those unseeable colour, I ' m talkin real number colors!"
4,She ' s now asking Fiji Flight path for a refund to which they are level out refusing to founder her.
4,Funnily plenty we taxi right on time and for the getting even flight we allow for about 10 minutes latterly.
4,"Looking over my flights, I ' m not really feeling confident and simply wanted to check if I should go ahead with this flight, or if I should be contacting American to see about a modification?"
4,"I like gentoo / portage. .. I think there should be a project that will allow for portage to create deb packages, since portage is an awesome instrument for compile - time contour"
4,"I know times are hard, but why do these companies diss our intelligence operation by claim that the latest penny - pinch reduction in service is an melioration?"
4,are you serious and yeah you can explain how something can be out of stock at a reduced price and magically in stock the import the price pass backward up thats my payoff here
4,dear i keep cxling a subscription rescript amp it keeps re itself frustratedinbisbee
4,on the tar mackintosh for two hours and nobody is give any info now we have transfer planes delta step up with 20000 notcool
4,Basically the * like * thing happened on the income tax return trajectory. .. except this time they said they bear absolutely no record of her ticket and forced us to buy another one.
4,when executive program is supposed to predict you rearwards within twenty four hours and its been quint days sprintfail worstcustomerservice
4,your rates are the reason why cable society are go under you excite 45m for new customers but 104m for the same internet speeds for older valued customers overseas telegram companies like you are a prime example of legalized theft forgetcable netflix hulu
4,"This is only $ fifty three but the precept of the matter, I was not informed of the details of the charges to my credit card, let alone the absolutely horrible service, I am sure this is in violation of some consumer tribute turn or locomotion agents act."
4,cry me demented but we get it on the suggestion we will be sure to evanesce on
4,Yesterday I was in the economic system class of Turkish Airlines on my way backward home but still had one of the dependable repast I ' ve ever so had on board (aand it was free! )
4,massive thank you to and for engender this resolve for me in a seasonable manner they cover my grumpiness well
4,it make me sick dawg chipotle wild scrap the disrespect is material brodie
4,Scolding me for an undesirable solution when you haven ' t specified your good essential isn ' t helpful.
4,"Nonetheless, the real tragedy was actually the come rearward trip!!"
4,i hate your website tried multiple times in a booking and it will not go along to payment and hangs tried on all different browsers no choice but to book thru travel agent but exec line treats travel agency booking like pariah why
4,They offered nobelium centering or help other than asking multitude to go out the carge place.
4,need to determine whatever tf is going on w my phone i cant even listen to my euphony i earnings for it i easily be able to hear to it
4,since amazon river cancel my uk membership i am stuck with chetan bhagat in the literature section do you even know what lit is fuck
4,"Are my expectation inordinate (do not surcharge for services, rematch to complaint electronic mail )? ???"
4,"And I, on the other hand, am passing garbled and torment that I can ' t speak to Aeromexico directly (or email them, for that subject )."
4,that is not true at all the regular monetary value for 2 yrs is rs 89376 and the discounted price is rs 89376 if the promotional code was genuinely valid there would have been a 25 drop as claimed in the final discounted price so far running a fake sale i recvd an electronic mail offering 25 off on my next new purchase so i went complete to bcoz i wanted a new domain and it seems that you are not offering a 25 discount at all cheap pr stunt i must say you will turn a loss customers i tell you that one
4,The perfect inability of anyone representing AA at the airdrome or on the sound to address the position was beyond irresponsible.
4,Their security measures stave is unmannerly and there is no construct of organized embarkation at Heathrow.
4,i am having so much trouble with my apple gem state accepting my requital contingent i cannot download or update anything i am about to go to android this is horrible nothing is lick for me
4,why should we be loyal to your airline business yet again for an external escape youve placed me in a middle seat diamondmeansnothing
4,What ' s the next move (besides evidently ne'er flying with them once more and advising everyone I know to do the like )?
4,One concierge yet hugged me when we entrust and enunciate she was going to overlook me!
4,I simply had the worst experience book escape to Mexico with Interjet.
4,after 4 recaptcha i in conclusion get to paywhat a bad user experience i got herenearly do not want to buy anymore
4,We lose a hale day in Rome b / c Delta has no clue how to decently service their planing machine.
4,"Only to be told that they put on ' t give indemnity or cancellation advice on this bit, you need to do it online! !!"
4,you have conk out to put in my internet for 2 days respective headphone call in and i cant even get a manager incompetent wastedmyweekend
4,this new email change sucks detest it go backward to former notfunctional
4,These were family with tike expect and this was an absurd way to wield the post.
4,absolute caper after waiting all mean solar day for an order point on fri on quality
4,I have been basically been rob and this could have turned out alot worse than it practice experience i miss my connecting flight.
4,massively defeated with two of your eating house tonight
4,i detest you how heavy is it to not frame onion in my wetback
4,"If they can not responsibly transport a frank, YOU are not secure on this Air hose."
4,will there be an update coming presently thats gonna fix my bombardment issuance or should i just throw away the hale earpiece and use a pigeon
4,"When I purchase a secret plan, I clear an agreement between me and the producer - not a interlocutor! BAD MOVE Activision."
4,"The employee are incompetenent, don ' t care and the airline is incompetent of comprise trusted to transport an beast, child or anything of time value."
4,"After speaking with an exceedingly unhelpful and underbred supervisor, and explaining our situation, she said she would investigate further and disappeared, only to return 45 mo later to again repeat there were no seats for us."
4,What is most thwarting is that there is no way to find a flight of stairs with two upgrade - able seats without foretell AA - - and waiting through three minutes of canned drivel before we find a interpreter and go through the whole ' wanna ' list with her.
4,I am flying Virgin Australia to Los Angeles and absolutely hate plane food (always have horrible stomach pains after wipe out it) Wanting to convey my own intellectual nourishment on the plane but concerned with customs etc with what I can bring instead of paying large amounts of money for food beyond customs which is equally horrible.
4,The transit at Heathrow (a fueling and more rider stop) was the most miserable experience in all our flying class. .. . We would not recommend to anyone flying through Heathrow as transit passengers.
4,I am write today to tell you how discomfited I am in your misleading business practices and nauseate I am with your customer support (a common thread in many reviews for your ship's company ).
4,I should have known dependable than to book a modest - cost flying through an agency. .. or at least through That office!
4,"I try to call the airline business but nonentity picked up, now I ' m waiting for the reply email which I wear ' t know whether they will yet cared to read."
4,We were proud of with our flight and now look forrad to our trip on the Dreamliner this summertime.
4,"And, its been reappropriated by the pretty people as a rattling facial crease cream."
4,"As a current PT student, I have an * amazing * network of come up principal at a figure of bay region companies, flop now."
4,I was only enquire: And something alone dissimilar: Thanks you guys!
4,Withal our organisation say I can construct you a new Promo computer code now!
4,They chop chop checked us in and to our surprisal we were all seat in concert 9ABCDE.
4,my ma constantly require me if i want mcdonalds and i think that is rlly beautiful
4,"Voila - - no checkered luggage, no carry - on luggage, no problems (and break flip - flops on your human foot )."
4,this is how ups delivered my package out 800 of xmas money for my 5 child angry mommy
4,help me rt ok the boxful irritating i updated my telephone what else do you require from me
4,Every flight on AA that we ' ve taken since the merger we could hear the flight attendants kvetch and they could care to a lesser extent about the service.
4,Instead of being helpful and sympathetic the Australian staff act behind the counters sent me away 4 times to different counters to try and separate out my problem which take over an ace 1 / 2 hours.
4,I certainly paid plenty for the just the ticket and don ' t see any reason to give more money for something that ne'er cost money until now.
4,What is the point of client tending factor when they have to confabulate every interrogative.
4,"In a way, this may be George herbert walker bush ' s brilliance, that he understands what lie in Americans are unforced to accept, and not take over."
4,i bear already sent the item in message dm amp spoke to customer services but no organic structure tells why do you need extra information from me even every contingent is like you reverify every account annually what is your criteria to do so
4,They forced us to suss out our bags or pay several hundred dollars to carry them on even though we had less so when we went downwardly and the purse were received carry size for any other airline.
4,We were originally looking at booking thru flight centre but they want to charge us $ xx additional per person per flight on height of flight price to get a tag I just feel ripped off so I ' m looking at booking lineal myself.
4,i get laid my internet speed technically says up to 25mb but all i am acquire is 8mb that is not even half not acceptable
