emotion_bucket,text
4,9 days and counting tho appreciate people are busy and have work load to get done but 9 days without a response that is rather a muckle is not it
4,"I fly this route annually / bi - yearly to visit in - laws with my nipper and husband who were on this flight with me, they ' re all fine (kids were 16 months and 3 ), I ' m still a mess, can ' t watch safety telecasting and have to involve valium."
4,"I called Delta, who sound out there was nothing they could do - if the change of location agent gain ' t alteration it, I ' m SOL."
4,\ n \ naan alternative account is the prosperous one: there is no G - d.
4,Also they make out send me an email with an offer of a voucher to be redeem on a future Thomas cook vacation (expires in 12 months) but as I am unable to do that I have asked them to send me a bank check which you are de jure entitled to do.
4,I am altogether befuddled with the regulation at this degree!
4,She was sit down future to me and say that she would have been discharge on the spot for such a landing place!
4,can you please stop make me update my xbox every dyad of days i dont get many days off and i require to be able to wreak
4,how the heck is that potential it is a carte du jour cut by yall
4,"The moral of the storey use yoru mastercard as I did and dispute the transaction on return so they wil actually listen as the Booking was made from the UK our rules apply regardless of the lack of clarity on the Airasia site so I will update the upshot, for me its not about the £ 20 its more about the priciple now so fight on; )"
4,"The flight leaves late ascribable to late inbound foxiness - (which is a b self justification really - - a more honest one would be the craft was late because its on an end to end schedule with very close turnaround times, and we stuffed up somewhere earlier in the day )."
4,can you please order me why my 7 almost burn a kettle of fish in my pant and why my flashlight or camera doesnt work now
4,it is every appearance even the damn commercial i get 1 minutes and so bam mistake
4,And this was how I was requite What a dirty client allegiance payoff.
4,hey the hale idea of dvr is so you dont have to follow commercialswhat am i paying for
4,really because i used to have 3gb which i never ran out of and so all of a sudden id use up all my data in a month without actually serve anything had to upgrade to 15gb and now i apparently use 80 of that cant wait to tack to trine drum roll on end of contract
4,i ordered several one hundred dollars worth of clothes and shoes for a trip i have in a couple days you delivered it to the wholly wrong state sc this needs to be fixed as presently as potential asap and delivered to my address in florida nothappy
4,It kind of defeats the intent of going to the airdrome the day before if we are go to have to endure and queue in the same waiting line that we would have stood in had we just taken our cases in the morning!
4,so i used for the 1st and final time food was more than i time of day later on than promised and was cold nothappy
4,ur freshen up macbook pro sucks assault and battery percentage stays the same random vibrating sound and i only stimulate it for 2 months
4,shoutout to the unspoilt logic gate agentive role e'er at very communicative and informative
4,"I ' ve been very happy with the sturdy construction of the Timbuk2 packsack and messenger bags which I already own, and this case, which have the Fervor utterly, is no exception."
4,we are so glad to try this tweet us if you ever so have any question or need assistance we are here to support you
4,ohio i roll in the hay nemo got to say the drawing is unspoiled aisha
4,Awesome intimately I ' m felicitous I was able bodied to help you out!
4,"They are really cute; I am a size 9 and they are a wee bit declamatory, but I did not bring back them because they are so prosperous and cool in the summertime."
4,"I ordinate this token for my daughter, she perfectly love it!"
4,"If you do something stupid like airstream it, and then that ' s a consequence, besides."
4,"I am try out to choose my seats on "" manage my booking "". .. using seat guru as a guide, but the cabin layout is completely dissimilar compared to what seat guru layout says. .. . help!"
4,I like my mould iron and Lupus erythematosus Creuset ovens a WHOLE peck better for every imaginable purpose.
4,I would like to talk to your managing director because this is not satisfactory.
4,"Fore warned is fore armed - on a recent holiday to Jamaica my girlfriend became seriously ill and had to be put into a infirmary (very frightening as you can imagine) However, when she was released to fly the next day I called Air Jamaica and was told the alteration fee would be $ 150 each."
4,your new update makes it inconceivable for me to still open up my phone aspect at the time or do anything
4,"Another Crosman art object of detritus took it out of the loge, and it is rattle."
4,There were xi family wait and as this haul on with absolutely no communicating there was obviously frustration.
4,Your deficiency of activeness speaks volume about your business exercise (shady) and you miss of interest in customer satisfaction.
4,"We love Gamewright biz, and this is speedily go another family line deary."
4,gerry i have been through some thing but i have never been through anything like this this is a alarm news report amp im so sorry you experienced this i hope lead actions against the driver
4,"Oh hellow Linux_mafia: thank you for your help, i aslo try that and it yet doesn ' t work."
4,dandy interrogation send us a decimetre for the deets colleenlicudine
4,we dress upgrade the service but realise it could ever be better apologies for the issues today kevin
4,All in all my flying from the instant of assay in to when I land was an absolute incubus.
4,"i didnt install alpha i didnt break anything and the proftpd channel is dead, plus google habit help me"
4,"Both times my arriere pensee has been available online for quatern days, pending completion of transaction with my reference card, so it disappears and I have to start over!"
4,"It has been completely replace by the Scientific Method acting, which is the great breakthrough of all time."
4,I give for a return transfer and didn ' t need to spend time finding an Cyberspace coffeehouse or somewhere with wifi to sort something out that I think I ' d be prebooked as I only have a short weekend trip away. .. please help!
4,Its a expensive vacation hence wherefore need to make out mary leontyne price so can save! !!
4,I sure enough bear enought for the tag and don ' t see any reason to give more money for something that ne'er be money until now.
4,world i gibe my data point on the first HD and there is no egress with that!
4,"My interrogative is, - most sparing wayOR is there any other choice? ???"
4,"My family has booked a holiday with the like locomotion agent but as 2 dissimilar engagement, one for us and the kids, another for the in - law!!"
4,"I was waste, some so uncommon point, I presume not cerebrate about it."
4,"I desire to be able to see more colors, more than infra - carmine and ultra - violet; I ' m not talking about those invisible colour, I ' m talkin REAL colors!"
4,She ' s now asking Republic of fiji Skyway for a refund to which they are flat out refuse to pass on her.
4,Funnily enough we taxi right on time and for the retort trajectory we left about 10 proceedings lately.
4,"Looking over my flights, I ' m not really feeling confident and just wanted to fit if I should go ahead with this flight, or if I should be touch American to see about a change?"
4,"I like gentoo / portage. .. I conceive there should be a project that will allow portage to make debutante packages, since portage is an awesome dick for compile - time conformation"
4,"I know times are hard, but wherefore do these company insult our intelligence by arrogate that the latest penny - pilfer reduction in service is an betterment?"
4,are you grievous and yeah you can excuse how something can be out of stock at a reduced price and as if by magic in farm animal the moment the price goes back up thats my outcome here
4,honey i keep cxling a subscription order amp it keep re itself frustratedinbisbee
4,on the tar mackintosh for ii hour and nobody is leave any info now we have change planes delta maltreat up with 20000 notcool
4,Essentially the * same * matter chance on the return flight. .. except this time they said they have absolutely no record of her ticket and force us to buy another one.
4,when supervisor is supposed to promise you back within 24 minute and its been 5 daylight sprintfail worstcustomerservice
4,your rates are the reason why cable companies are go under you agitate 45m for new customers but 104m for the same net speeds for older valued customers cable companies like you are a prime example of legalized theft forgetcable netflix hulu
4,"This is only $ fifty three but the precept of the matter, I was not informed of the details of the charges to my citation scorecard, let alone the absolutely horrible service, I am sure this is in violation of some consumer protection act or travel agents act."
4,call me dotty but we love the proffer we will be certain to fleet on
4,Yesterday I was in the economy class of Turkish Airlines on my direction backward home but still had one of the best meal I ' ve of all time had on board (aand it was free! )
4,monolithic thank you to and for getting this resolved for me in a well timed personal manner they handle my contrariness well
4,it makes me sick dawg chipotle wild trash the contempt is existent brodie
4,Scolding me for an inapplicable solution when you haven ' t specialise your full essential isn ' t helpful.
4,"Still, the real disaster was really the come back tripper!!"
4,i hate your website tried multiple time in a booking and it will not cover to defrayment and hang tried on all different browser no choice but to book thru travel agent but exec line treats travel agency booking like pariah why
4,They volunteer NO focal point or help other than asking masses to give the carge office.
4,pauperization to fix whatsoever tf is going on w my phone i cant even listen to my medicine i remuneration for it i best be able to listen to it
4,since amazon cancelled my uk membership i am stuck with chetan bhagat in the lit section do you even know what lit is fuck
4,"Are my prospect undue (do not rob for services, rematch to complaint emails )? ???"
4,"And I, on the other mitt, am passing confused and frustrated that I can ' t speak to Aeromexico directly (or e mail them, for that thing )."
4,that is not true at all the regular price for 2 yrs is rs 89376 and the discounted price is rs 89376 if the promotional code was really valid there would have been a 25 drop as claimed in the final discounted price so far running a phony sale i recvd an email offering 25 off on my next new purchase so i went over to bcoz i wanted a new domain and it seems that you are not offering a 25 discount at all cheap pr stunt i must tell you will lose customers i tell you that one
4,The complete unfitness of anyone representing associate in arts at the airdrome or on the phone to plow the situation was beyond irresponsible.
4,Their security system staff is yokelish and there is no conception of organized embarkation at Heathrow.
4,i am having so much trouble with my apple id consent my payment detail i cannot download or update anything i am about to go to android this is horrible nada is working for me
4,why should we be loyal to your airline nevertheless again for an international flight youve placed me in a middle prat diamondmeansnothing
4,What ' s the next movement (besides obviously never fly with them again and advising everyone I roll in the hay to do the same )?
4,One concierge even embrace me when we leave and pronounce she was lead to miss me!
4,I scarce have the worst experience reserve flights to Mexico with Interjet.
4,after 4 recaptcha i in conclusion get to paywhat a bad user experience i got herenearly do not want to buy anymore
4,We lost a hale daylight in Rome b / c Delta has no cue how to decently service their planes.
4,"Only to be order that they don ' t give indemnity or cancellation advice on this number, you want to do it online! !!"
4,you have failed to install my net for 2 days respective telephone set calls in and i cant yet get a manager incompetent person wastedmyweekend
4,this new email modification sop up hate it go rearward to sure enough notfunctional
4,These were menage with children hold back and this was an absurd manner to manage the state of affairs.
4,absolute antic after expect all day for an order localise on fri on prime
4,I have been fundamentally been robbed and this could have turned out alot risky than it did have i missed my connecting flying.
4,massively defeated with 2 of your restaurants tonight
4,i detest you how intemperate is it to not set onion plant in my greaser
4,"If they can not responsibly channel a hotdog, YOU are not secure on this Airway."
4,will there be an update coming soon thats gonna fix my assault and battery issues or should i just throw off the unhurt headphone and use a pigeon
4,"When I bribe a biz, I reach an agreement between me and the manufacturer - not a contact! BAD MOVE Activision."
4,"The employees are incompetenent, don ' t care and the airline is unequal to of constitute trusted to channelize an animal, nestling or anything of value."
4,"After speaking with an extremely unhelpful and rude executive program, and explaining our situation, she said she would investigate further and evaporate, only to return 45 minutes by and by to over again repeat there were no seats for us."
4,What is most frustrating is that there is no way to find a flight with two upgrade - able seats without calling AA - - and waiting through with three minute of canned drool before we find a representative and go through the whole ' wanna ' inclination with her.
4,I am vaporize Virgin Australia to Los Angeles and absolutely hate plane food (always have horrible stomach pains after eating it) Wanting to bring in my ain food on the plane but concerned with customs etc with what I can bring instead of paying large amounts of money for food for thought beyond custom which is equally horrible.
4,The transit at Heathrow (a fueling and more rider stop) was the most hapless experience in all our fly years. .. . We would not recommend to anyone flying through and through Heathrow as transit passengers.
4,I am writing today to tell you how disappointed I am in your misleading business practices and churn up I am with your customer documentation (a usual thread in many reviews for your companionship ).
4,I should have screw better than to book a low - cost flight through an federal agency. .. or at least through That federal agency!
4,"I tried to call the airline business but nobody picked up, now I ' m waiting for the reply electronic mail which I assume ' t have it off whether they will even like to read."
4,We were proud of with our flights and now await frontward to our trip up on the Dreamliner this summer.
4,"And, its been reappropriated by the pretty mass as a grand facial wrinkle cream."
4,"As a current PT student, I have an * get * electronic network of rising stars at a number of bay area fellowship, flop now."
4,I was only marvel: And something altogether dissimilar: Thanks you guy!
4,Nevertheless our organization tell I can get to you a new Promo computer code now!
4,They cursorily ensure us in and to our surprisal we were all seat together 9ABCDE.
4,my mom e'er postulate me if i desire mcdonalds and i think that is rlly beautiful
4,"Voila - - no checked baggage, no carry - on luggage, no job (and wear snotty nosed - flops on your feet )."
4,this is how ups birth my package out 800 of christmas day money for my 5 children angry mommy
4,help me rt fine the boxes nark i update my earphone what else do you want from me
4,Every flight of steps on AA that we ' ve take on since the merger we could hear the flight attendants complain and they could care less about the service.
4,Instead of being helpful and sympathetic the Australian staff working behind the counters sent me away 4 times to unlike counters to try and sort out my job which took all over an 1 1 / deuce hours.
4,I for sure paid enough for the slate and don ' t see any grounds to give more money for something that never cost money until now.
4,What is the compass point of client upkeep agent when they have to confabulate every question.
4,"In a way, this may be Pubic hair ' s genius, that he understands what rest Americans are uncoerced to have, and not take."
4,i had already air the item in message dm amp spoke to customer services but no body tells why do you need supererogatory information from me even every detail is same you reverify every score annually what is your criteria to do so
4,They forced us to check our bags or pay several 100 dollars to carry them on even though we had less then when we go down and the bags were standard carry size of it for any other airline.
4,We were earlier looking at book thru flight midpoint but they want to charge us $ 20 extra per somebody per flight on top of flying price to get a ticket I just feel ripped off so I ' m looking at booking direct myself.
4,i bed my internet upper technically says up to 25mb but all i am getting is 8mb that is not even half not satisfactory
4,9 day and counting tho appreciate the great unwashed are busy and have workloads to get through but 9 daytime without a response that is quite a lot is not it
4,"I fly this route annually / bi - annually to visit in - practice of law with my children and husband who were on this flight with me, they ' re all ok (thomas kid were 16 months and 3 ), I ' m still a mess, can ' t scout safety video and have to look at valium."
4,"I phone Delta, who said there was nil they could do - if the travel agent won ' t variety it, I ' m colloidal solution."
4,\ n \ naan alternative account is the well situated one: there is no G - d.
4,Also they did send me an electronic mail with an offer of a voucher to be pay off on a next Thomas cook holiday (expires in 12 months) but as I am unable to do that I have involve them to send me a cheque which you are lawfully entitled to do.
4,I am altogether lost with the ordinance at this stagecoach!
4,She was sit future to me and said that she would have been force out on the spot for such a landing place!
4,can you please stop making me update my xbox every couple of years i dont get many days off and i want to be able to encounter
4,how the heck is that potential it is a wag issued by yall
4,"The moral of the story use yoru mastercard as I did and dispute the transaction on income tax return then they wil actually listen as the Booking was made from the u.k. our rules apply disregarding of the lack of clarity on the Airasia site so I will update the outcome, for me its not about the £ xx its more about the priciple now so fight on; )"
4,"The trajectory go away late ascribable to late inbound craft - (which is a b excuse really - - a more honest one would be the craft was late because its on an end to end schedule with very tight reverse times, and we stuffed up somewhere earlier in the day )."
4,can you please tell me why my 7 nearly cauterise a hole in my pants and why my torch or tv camera doesnt work now
4,it is every show still the damn commercial i get i minutes and then bam error
4,And this was how I was give back What a icky client trueness wages.
4,hey the solid idea of dvr is so you dont have to watch commercialswhat am i pay for
4,genuinely because i used to have 3gb which i never ran out of then all of a sudden id use up all my data in a month without really doing anything give birth to upgrade to 15gb and now i apparently use 80 of that cant wait to switch to 3 roll on end of contract
4,i order several hundred dollars worth of clothes and shoes for a trip i have in a couple days you delivered it to the completely incorrect commonwealth sc this demand to be fixed as soon as possible asap and deport to my address in florida nothappy
4,It variety of defeats the purpose of going to the drome the day before if we are go to have to stand and line up in the same queue that we would have stood in had we just claim our cases in the morning!
4,so i used for the first and net time intellectual nourishment was more than 1 hr later than promise and was cold nothappy
4,ur refurbished macbook pro suck barrage fire percentage stays the like random vibrate sounds and i only had it for deuce months
4,shoutout to the good gate federal agent ever at very communicatory and instructive
4,"I ' ve been very happy with the hardy twist of the Timbuk2 backpacks and messenger bags which I already own, and this case, which holds the Fervour perfectly, is no exception."
4,we are so felicitous to hear this tweet us if you of all time have any dubiousness or require help we are here to support you
4,oh i bed nemo got to allege the drawing is practiced aisha
4,Awesome intimately I ' m well chosen I was able bodied to help you out!
4,"They are truly cute; I am a size 9 and they are a wee bit large, but I did not hark back them because they are so well to do and cool in the summer."
4,"I ordered this particular for my daughter, she dead lie with it!"
4,"If you do something stupid like washing it, then that ' s a result, overly."
4,"I am trying to choose my seats on "" manage my engagement "". .. using seat guru as a guide, but the cabin layout is all unlike compared to what backside guru layout says. .. . help!"
4,I like my cast iron and Lupus erythematosus Creuset ovens a WHOLE hatful better for every imaginable determination.
4,I would like to talk to your coach because this is not satisfactory.
4,"Bow warned is fore armed - on a recent vacation to Jamaica my girlfriend get seriously ill and had to be put into a hospital (very frightening as you can imagine) However, when she was released to fly the next day I called Zephyr Jamaica and was told the change fee would be $ 150 each."
4,your new update have it impossible for me to still open up my phone look at the time or do anything
4,"Another Crosman art object of dust take it out of the box, and it is rattle."
4,There were 11 family waiting and as this sweep up on with perfectly no communication there was plain foiling.
4,Your lack of activity speaks mass about your business practice (shady) and you lack of interest in client expiation.
4,"We make love Gamewright games, and this is apace becoming another home favourite."
4,gerry i have been through with some matter but i have never been through anything like this this is a horrify write up amp im so sorry you experienced this i hope takes action against the driver
4,"Ohio hellow Linux_mafia: thank you for your help, i aslo adjudicate that and it stock still doesn ' t work."
4,neat question send us a dm for the deets colleenlicudine
4,we perform elevate the service but actualise it could constantly be better apologia for the issues today kevin
4,All in all my flight of steps from the bit of handicap in to when I land was an inviolable nightmare.
4,"i didnt install alpha i didnt break anything and the proftpd transmission channel is dead, plus google habit help me"
4,"Both times my mental reservation has been available online for 4 days, pending culmination of dealing with my credit card, then it disappears and I have to start terminated!"
4,"It has been completely put back by the Scientific Method acting, which is the gravid breakthrough of all time."
4,I paid for a return transferral and didn ' t want to spend time finding an Net coffee bar or somewhere with wifi to sort something out that I think I ' d be prebooked as I only have a short weekend trip away. .. please help!
4,Its a expensive vacation hence wherefore need to know monetary value so can save! !!
4,I certainly paid enought for the ticket and don river ' t see any reason to give more money for something that never be money until now.
4,piece i moderate my information on the first HD and there is no result with that!
4,"My interrogation is, - most stinting wayOR is there any other option? ???"
4,"My syndicate has book a holiday with the same travel agent but as two dissimilar bookings, one for us and the child, another for the in - laws!!"
4,"I was devastate, some so uncommon item, I make bold not mean about it."
4,"I require to be able to see more colors, more than infra - crimson and extremist - reddish blue; I ' m not talking about those invisible colors, I ' m talkin REAL colours!"
4,She ' s now call for Republic of fiji Respiratory tract for a refund to which they are flat out refusing to founder her.
4,Funnily enough we taxi right on on time and for the restitution trajectory we left about ten minutes late.
4,"Looking over my flights, I ' m not really feeling confident and just wanted to check if I should pass away ahead with this flight, or if I should be reach American to see about a change?"
4,"I like gentoo / portage. .. I intend there should be a project that will allow for portage to create deb packages, since portage is an awesome prick for compile - time configuration"
4,"I know time are hard, but why do these companies insult our news by claiming that the latest centime - twitch diminution in service is an improvement?"
4,are you serious and yeah you can explain how something can be out of line of descent at a reduced price and magically in stock the moment the price go back up thats my issuance here
4,love i keep cxling a subscription order amp it keep open re itself frustratedinbisbee
4,on the jack tar mack for ii hours and nobody is give way any info now we have switch planes delta mistreat up with 20000 notcool
